{"summary":"Synthetic hosting invoice for September is due in ten days.","category":"billing","importance":"important","uncertainty":["Year inferred from the invoice period"],"deadline":{"text":"due October 13","instant":"2026-10-13T00:00:00Z","zone":"Europe/London","ambiguous":true},"serviceIds":["1d2c3b4a-5e6f-4a7b-8c9d-0e1f2a3b4c5d"],"evidence":[{"chunkId":"src:body-v1:0","start":0,"end":64}],"suggestedActions":[]}
